{
  "schema": "SFS_SCALE_REGISTRY",
  "version": "0.1.0",
  "interval_unit": "semitones",
  "octave_size": 12,
  "default_scale_name": "natural_minor",
  "scale_order": [
    "major",
    "natural_minor",
    "dorian",
    "phrygian",
    "whole_tone",
    "chromatic",
    "cluster"
  ],
  "scales": {
    "major": {
      "display_name": "Major",
      "intervals": [0, 2, 4, 5, 7, 9, 11],
      "description": "Diatonic major scale."
    },
    "natural_minor": {
      "display_name": "Natural Minor",
      "intervals": [0, 2, 3, 5, 7, 8, 10],
      "description": "Natural minor scale without raised sixth or seventh degrees."
    },
    "dorian": {
      "display_name": "Dorian",
      "intervals": [0, 2, 3, 5, 7, 9, 10],
      "description": "Minor-type mode with a major sixth."
    },
    "phrygian": {
      "display_name": "Phrygian",
      "intervals": [0, 1, 3, 5, 7, 8, 10],
      "description": "Minor-type mode with a minor second."
    },
    "whole_tone": {
      "display_name": "Whole Tone",
      "intervals": [0, 2, 4, 6, 8, 10],
      "description": "Six-note scale built entirely from whole tones."
    },
    "chromatic": {
      "display_name": "Chromatic",
      "intervals": [0, 1, 2, 3, 4, 5, 6, 7, 8, 9, 10, 11],
      "description": "All twelve pitch classes."
    },
    "cluster": {
      "display_name": "Chromatic Cluster",
      "intervals": [0, 1, 2, 3],
      "description": "Four adjacent semitone pitch classes anchored at the configured root."
    }
  }
}
